{
  "spec_version": "1.0",
  "mechanic": "happy_hours",
  "name": "Выпечка −30 % ежедневно 19:00–21:00",
  "priority": 110,
  "stacking": {
    "group": "basket_discount",
    "mode": "exclusive"
  },
  "schedule": {
    "starts_at": null,
    "ends_at": null,
    "timezone": "Europe/Moscow",
    "windows": [
      {
        "days": [
          1,
          2,
          3,
          4,
          5,
          6,
          7
        ],
        "from": "19:00",
        "to": "21:00"
      }
    ]
  },
  "audience": {
    "segments": [
      "all"
    ],
    "statuses": [],
    "tiers": [],
    "exclude_staff": true,
    "holdout_pct": 0
  },
  "trigger": {
    "type": "purchase"
  },
  "conditions": [],
  "actions": [
    {
      "type": "discount",
      "scope": "items",
      "mode": "percent",
      "value": 30,
      "filter": {
        "category": {
          "in": [
            "bakery"
          ]
        }
      }
    }
  ],
  "limits": {
    "per_customer": null,
    "total_uses": null,
    "budget_total_minor": null,
    "budget_daily_minor": null
  },
  "content": {
    "title": "Выпечка −30 % ежедневно 19:00–21:00",
    "badge": "−30 %",
    "subtitle": "ежедневно 19:00–21:00",
    "terms": "Действует ежедневно 19:00–21:00 по времени точки. Скидка применяется к позициям категории автоматически."
  },
  "channels": {
    "showcase": true,
    "checkout": true,
    "push": false,
    "cashier": true
  },
  "meta": {
    "template_id": "lm-05",
    "template_params": {
      "windows": [
        {
          "days": "daily",
          "from": "19:00",
          "to": "21:00"
        }
      ],
      "action_type": "discount",
      "category": "bakery",
      "discount_pct": 30,
      "multiplier": "2",
      "show_timer": true
    },
    "show_timer": true
  }
}
